{
  "evaluation_id": "eval_writehere_20260624_154021",
  "agent_type": "writehere",
  "evaluation_timestamp": "2026-06-24T15:42:28.594920",
  "total_steps_evaluated": 67,
  "llm_call_accuracy": 52.23880597014925,
  "tool_call_accuracy": 100.0,
  "parameter_format_accuracy": 100.0,
  "response_parse_accuracy": 52.23880597014925,
  "total_trajectories": 104,
  "avg_trajectory_duration_ms": 0.0,
  "avg_steps_per_trajectory": 0.6442307692307693,
  "trajectory_success_rate": 42.30769230769231,
  "avg_rationality_score": 56.92307692307692,
  "avg_efficiency_score": 64.42307692307692,
  "overall_step_level_score": 76.11940298507463,
  "overall_trajectory_level_score": 59.92307692307692,
  "trajectories": [],
  "detailed_report": {
    "summary": {
      "total_steps": 67,
      "total_trajectories": 104,
      "llm_calls": 67,
      "tool_calls": 0
    },
    "step_distribution": {
      "llm_call": 67,
      "tool_call": 0,
      "planning": 0,
      "execution": 0,
      "memory_read": 0,
      "memory_write": 0,
      "other": 0
    },
    "performance_metrics": {
      "avg_duration_ms": 0.0,
      "max_duration_ms": 0,
      "min_duration_ms": 0
    },
    "error_analysis": {
      "llm_errors": [
        {
          "step_id": "step_79f0de8c",
          "error": "No result returned"
        },
        {
          "step_id": "step_d4bb9b41",
          "error": "No result returned"
        },
        {
          "step_id": "step_590846cd",
          "error": "No result returned"
        },
        {
          "step_id": "step_8bf6022b",
          "error": "No result returned"
        },
        {
          "step_id": "step_6875e3bf",
          "error": "No result returned"
        },
        {
          "step_id": "step_20045701",
          "error": "No result returned"
        },
        {
          "step_id": "step_1e5bfccb",
          "error": "No result returned"
        },
        {
          "step_id": "step_3cfb4129",
          "error": "No result returned"
        },
        {
          "step_id": "step_53f9c3c4",
          "error": "No result returned"
        },
        {
          "step_id": "step_f282f417",
          "error": "No result returned"
        },
        {
          "step_id": "step_8347fc4c",
          "error": "No result returned"
        },
        {
          "step_id": "step_18fbdebd",
          "error": "No result returned"
        },
        {
          "step_id": "step_0a79cfde",
          "error": "No result returned"
        },
        {
          "step_id": "step_690604cb",
          "error": "No result returned"
        },
        {
          "step_id": "step_7d254f3c",
          "error": "No result returned"
        },
        {
          "step_id": "step_b9b96a05",
          "error": "No result returned"
        },
        {
          "step_id": "step_6fdb4b26",
          "error": "No result returned"
        },
        {
          "step_id": "step_3fcd5efe",
          "error": "No result returned"
        },
        {
          "step_id": "step_8cabd253",
          "error": "No result returned"
        },
        {
          "step_id": "step_b28b30d3",
          "error": "No result returned"
        },
        {
          "step_id": "step_c9128ead",
          "error": "No result returned"
        },
        {
          "step_id": "step_a08acc71",
          "error": "No result returned"
        },
        {
          "step_id": "step_a7911717",
          "error": "No result returned"
        },
        {
          "step_id": "step_52340ecc",
          "error": "No result returned"
        },
        {
          "step_id": "step_c63217b7",
          "error": "No result returned"
        },
        {
          "step_id": "step_7a1b5998",
          "error": "No result returned"
        },
        {
          "step_id": "step_f2a01031",
          "error": "No result returned"
        },
        {
          "step_id": "step_424bfe9c",
          "error": "No result returned"
        },
        {
          "step_id": "step_9f453339",
          "error": "No result returned"
        },
        {
          "step_id": "step_b6183ef3",
          "error": "No result returned"
        },
        {
          "step_id": "step_8163c90d",
          "error": "No result returned"
        },
        {
          "step_id": "step_960d3a1b",
          "error": "No result returned"
        }
      ],
      "tool_errors": []
    }
  },
  "identified_issues": [
    "LLM 调用准确率较低：52.2%",
    "轨迹成功率较低：42.3%",
    "轨迹合理性得分较低：56.9",
    "轨迹效率得分较低：64.4"
  ],
  "improvement_suggestions": [
    "检查 LLM 调用的参数设置和 prompt 格式",
    "分析失败轨迹的共同特征，优化错误恢复机制",
    "审查执行流程，减少不必要的步骤和重试",
    "优化资源使用，减少冗余操作"
  ]
}