{
  "evaluation_id": "eval_writehere_20260624_144042",
  "agent_type": "writehere",
  "evaluation_timestamp": "2026-06-24T14:40:42.388710",
  "total_steps_evaluated": 45,
  "llm_call_accuracy": 66.66666666666666,
  "tool_call_accuracy": 100.0,
  "parameter_format_accuracy": 80.0,
  "response_parse_accuracy": 66.66666666666666,
  "total_trajectories": 9,
  "avg_trajectory_duration_ms": 0.0,
  "avg_steps_per_trajectory": 5.0,
  "trajectory_success_rate": 100.0,
  "avg_rationality_score": 85.0,
  "avg_efficiency_score": 100.0,
  "overall_step_level_score": 79.33333333333333,
  "overall_trajectory_level_score": 91.0,
  "trajectories": [],
  "detailed_report": {
    "summary": {
      "total_steps": 45,
      "total_trajectories": 9,
      "llm_calls": 27,
      "tool_calls": 18
    },
    "step_distribution": {
      "llm_call": 27,
      "tool_call": 18,
      "planning": 0,
      "execution": 0,
      "memory_read": 0,
      "memory_write": 0,
      "other": 0
    },
    "performance_metrics": {
      "avg_duration_ms": 0.0,
      "max_duration_ms": 0,
      "min_duration_ms": 0
    },
    "error_analysis": {
      "llm_errors": [
        {
          "step_id": "step_990135fd",
          "error": "模拟错误"
        },
        {
          "step_id": "step_a99232c3",
          "error": "模拟错误"
        },
        {
          "step_id": "step_42cf0277",
          "error": "模拟错误"
        },
        {
          "step_id": "step_aafac069",
          "error": "模拟错误"
        },
        {
          "step_id": "step_6ebad35a",
          "error": "模拟错误"
        },
        {
          "step_id": "step_d81a150d",
          "error": "模拟错误"
        },
        {
          "step_id": "step_5bced258",
          "error": "模拟错误"
        },
        {
          "step_id": "step_9ef79fb2",
          "error": "模拟错误"
        },
        {
          "step_id": "step_6f2a50d7",
          "error": "模拟错误"
        }
      ],
      "tool_errors": []
    }
  },
  "identified_issues": [
    "LLM 调用准确率较低：66.7%"
  ],
  "improvement_suggestions": [
    "检查 LLM 调用的参数设置和 prompt 格式"
  ]
}