{
  "evaluation_id": "eval_mo_shen_20260624_144042",
  "agent_type": "mo_shen",
  "evaluation_timestamp": "2026-06-24T14:40:42.402821",
  "total_steps_evaluated": 5,
  "llm_call_accuracy": 100.0,
  "tool_call_accuracy": 100.0,
  "parameter_format_accuracy": 100.0,
  "response_parse_accuracy": 100.0,
  "total_trajectories": 1,
  "avg_trajectory_duration_ms": 0.0,
  "avg_steps_per_trajectory": 5.0,
  "trajectory_success_rate": 100.0,
  "avg_rationality_score": 90.0,
  "avg_efficiency_score": 100.0,
  "overall_step_level_score": 100.0,
  "overall_trajectory_level_score": 94.0,
  "trajectories": [],
  "detailed_report": {
    "summary": {
      "total_steps": 5,
      "total_trajectories": 1,
      "llm_calls": 5,
      "tool_calls": 0
    },
    "step_distribution": {
      "llm_call": 5,
      "tool_call": 0,
      "planning": 0,
      "execution": 0,
      "memory_read": 0,
      "memory_write": 0,
      "other": 0
    },
    "performance_metrics": {
      "avg_duration_ms": 0.0,
      "max_duration_ms": 0,
      "min_duration_ms": 0
    },
    "error_analysis": {
      "llm_errors": [],
      "tool_errors": []
    }
  },
  "identified_issues": [],
  "improvement_suggestions": []
}