{
  "evaluation_id": "eval_writehere_20260624_153221",
  "agent_type": "writehere",
  "evaluation_timestamp": "2026-06-24T15:32:21.152818",
  "total_steps_evaluated": 0,
  "llm_call_accuracy": 100.0,
  "tool_call_accuracy": 100.0,
  "parameter_format_accuracy": 100.0,
  "response_parse_accuracy": 100.0,
  "total_trajectories": 37,
  "avg_trajectory_duration_ms": 0.0,
  "avg_steps_per_trajectory": 0.0,
  "trajectory_success_rate": 43.24324324324324,
  "avg_rationality_score": 0.0,
  "avg_efficiency_score": 0.0,
  "overall_step_level_score": 100.0,
  "overall_trajectory_level_score": 0.0,
  "trajectories": [],
  "detailed_report": {
    "summary": {
      "total_steps": 0,
      "total_trajectories": 37,
      "llm_calls": 0,
      "tool_calls": 0
    },
    "step_distribution": {
      "llm_call": 0,
      "tool_call": 0,
      "planning": 0,
      "execution": 0,
      "memory_read": 0,
      "memory_write": 0,
      "other": 0
    },
    "performance_metrics": {},
    "error_analysis": {
      "llm_errors": [],
      "tool_errors": []
    }
  },
  "identified_issues": [
    "轨迹成功率较低：43.2%",
    "轨迹合理性得分较低：0.0",
    "轨迹效率得分较低：0.0"
  ],
  "improvement_suggestions": [
    "分析失败轨迹的共同特征，优化错误恢复机制",
    "审查执行流程，减少不必要的步骤和重试",
    "优化资源使用，减少冗余操作"
  ]
}